{
  "anchor_identifier": "ANCH-2026-0001",
  "anchor_version": 1,
  "schema_version": "1.0-draft",
  "source": {
    "source_institution": "Satoshium Certifier",
    "source_artifact_type": "Satoshium Certified Record (SCRD JSON)",
    "source_system_identifier": "SCRD-SC-CERT-2026-0001",
    "source_version": "1.1",
    "source_location": "https://satoshium.us/certifier/certifications/SC-CERT-2026-0001/records/certified-record/scrd_json.json"
  },
  "representation": {
    "representation_type": "canonical_json",
    "representation_boundary": "Complete SCRD JSON document identified as SCRD-SC-CERT-2026-0001, excluding all linked or referenced external artifacts.",
    "canonicalization": {
      "method": "RFC 8785 — JSON Canonicalization Scheme (JCS)",
      "version": "RFC 8785",
      "parameters": {
        "encoding": "UTF-8",
        "trailing_newline": false
      }
    },
    "media_type": "application/json",
    "encoding": "UTF-8"
  },
  "integrity": {
    "methods": [
      {
        "method_id": "digest-1",
        "method_type": "cryptographic_digest",
        "algorithm": "SHA-256",
        "parameters": {
          "digest_encoding": "lowercase_hexadecimal"
        },
        "integrity_value": "945e272f49f433f2ddab5e94b65120f11cc5192a0916c15eca1b6ebd9c19af84",
        "generated_at": "2026-08-29T11:17:59-07:00",
        "verification_material": {
          "canonicalization": "RFC 8785 JCS",
          "canonical_encoding": "UTF-8",
          "canonical_byte_length": 4415,
          "comparison": "exact digest equality"
        }
      }
    ]
  },
  "provenance": {
    "source_provenance": {
      "source_institution": "Satoshium Certifier",
      "source_system_identifier": "SCRD-SC-CERT-2026-0001",
      "source_version": "1.1",
      "source_package": "SC-CERT-2026-0001",
      "source_location": "https://satoshium.us/certifier/certifications/SC-CERT-2026-0001/records/certified-record/scrd_json.json",
      "retrieved_for_anchor_at": "2026-08-29T11:17:59-07:00"
    },
    "representation_provenance": {
      "representation_type": "canonical_json",
      "representation_boundary": "complete SCRD JSON document",
      "canonicalization_method": "RFC 8785 — JSON Canonicalization Scheme (JCS)",
      "canonicalization_version": "RFC 8785",
      "encoding": "UTF-8",
      "canonical_byte_length": 4415
    },
    "generation_provenance": {
      "integrity_method": "cryptographic_digest",
      "algorithm": "SHA-256",
      "digest_encoding": "lowercase hexadecimal",
      "generated_at": "2026-08-29T11:17:59-07:00"
    },
    "anchor_record_provenance": {
      "anchor_identifier": "ANCH-2026-0001",
      "anchor_version": 1,
      "constructed_at": "2026-08-29T11:17:59-07:00",
      "production_stage": "pre-Stage-A candidate"
    }
  },
  "relationships": [
    {
      "relationship_type": "references_source",
      "target_identifier": "SCRD-SC-CERT-2026-0001",
      "target_system": "Satoshium Certifier",
      "target_location": "https://satoshium.us/certifier/certifications/SC-CERT-2026-0001/records/certified-record/scrd_json.json",
      "context": "Source Artifact whose complete SCRD JSON representation is governed by this Integrity Reference."
    }
  ],
  "record_state": {
    "integrity_state": "current",
    "publication_state": "unpublished",
    "lifecycle_state": "draft"
  },
  "verification_history": [],
  "corrections": [],
  "notes": "First production Integrity Reference candidate. Identifier assigned; Stage A Validation and Initial Verification have not yet been completed."
}
